Name,Handle,Timestamp,Verified,Content,Comments,Retweets,Likes,Analytics,Tags,Mentions,Emojis,Profile Image,Tweet Link,Tweet ID
Pazel,@Pazelrhm,2024-07-16T10:48:40.000Z,False,خونه بدون زن این شکلیه، فقط کافیه‌ تمیزگونه زندگی کنیم!,210,99,5.3K,303K,[],[],[],https://pbs.twimg.com/profile_images/1767768590009217024/Tsw5tf4r_normal.jpg,https://x.com/Pazelrhm/status/1813163839711510607,tweet_id:1813163839711510607
سکینه خاتون,@sakinekhaton,2024-07-20T19:56:30.000Z,False,"حضرت آقا دنبال شیر زن هستن برای نجات کشور !!!

خانمایی که عشق امام زمان را در قلب تان دارید و دوست دارید امام زمان از شما راضی باشن فقط بخاطر خدا و امام زمان.... این بحران را دریابید و الان که آینده تاریخ شیعه به تصمیم شما وابسته است مجاهدت فرزندآوری کنند",0,3,10,49,[],[],[],https://pbs.twimg.com/profile_images/1545099947401310208/CYb_HA52_normal.jpg,https://x.com/sakinekhaton/status/1814751255161426154,tweet_id:1814751255161426154
. ..امید روشن,@omid_133A,2024-07-19T15:51:41.000Z,False,"تا آخر گوش کنید.

با بخشی از صبحت هاش موافقم..بخصوص آخرش...

ازنظر من اشکال اصلی فقط همون فرهنگ عقب مانده عرزشی و نداشتن امنیت در این کشور..
فرهنگ ضد #زن..که حاکم بر جامعه ماشده!",4,4,34,1K,['#زن'],[],[],https://pbs.twimg.com/profile_images/1704927679131119616/h3Tpr1K-_normal.jpg,https://x.com/omid_133A/status/1814327259798352092,tweet_id:1814327259798352092
Niloo Far Naeimi,@NilooFarNaeimi,2024-07-20T15:12:01.000Z,True,"ای کاش امیر المومنین امارت اسلامی یک زن بود، تا مردم جسارت صحبت کردن در مورد بی لیاقتی، بی کفایتی، بی صلاحیتی و اشتباهات،
 رهبر تروریستان را می داشتند. 
در این کشور فقط اشتباهات زنان دیده میشود.",2,1,8,391,[],[],[],https://pbs.twimg.com/profile_images/1797555878557589504/fh9aWm_k_normal.jpg,https://x.com/NilooFarNaeimi/status/1814679664448659915,tweet_id:1814679664448659915
